{"type":"config","name":"Chimp128 runtime optimization","metricName":"chimp128_runtime_us","metricUnit":"µs","bestDirection":"lower"}
{"run":1,"commit":"94551f9","metric":962.9880742729885,"metrics":{},"status":"keep","description":"Baseline for chimp128 runtime using just bench-target; add autoresearch.md/autoresearch.sh/autoresearch.checks.sh infrastructure","timestamp":1773504019766,"segment":0}
{"run":2,"commit":"656a740","metric":943.249552854506,"metrics":{},"status":"keep","description":"Optimize chimp128 encode/decode ring-buffer indexing: replace iterator-based fallback scan with manual bounded loop and use bitmask (&127) for modulo-128 indexing","timestamp":1773504094716,"segment":0}
{"run":3,"commit":"465fc51","metric":934.797589779669,"metrics":{},"status":"keep","description":"Reduce chimp128 lookup overhead: use u32 lookup table in encode and remove unused decode lookup table writes","timestamp":1773504168408,"segment":0}
{"run":4,"commit":"f98ef4c","metric":917.906839079959,"metrics":{},"status":"keep","description":"Speed up bin helpers used by chimp128 by replacing tiny-array iteration/position lookups with direct match-based bin_count/bin_encode/bin_decode","timestamp":1773504235495,"segment":0}
{"run":5,"commit":"f98ef4c","metric":936.7174546878467,"metrics":{},"status":"discard","description":"Tested forcing inline(always) on chimp bin helper functions; benchmark regressed so reverted","timestamp":1773504286455,"segment":0}
{"run":6,"commit":"f98ef4c","metric":932.383126322746,"metrics":{},"status":"discard","description":"Tried switching decode ring-buffer safety assert! to debug_assert! to remove runtime check overhead; no improvement over best","timestamp":1773504328356,"segment":0}
{"run":7,"commit":"57b2437","metric":759.7242453100638,"metrics":{},"status":"keep","description":"Replace chimp128 encode fallback ring-buffer scan with O(1) previous-value reference when hash lookup misses, removing per-sample 128-entry search","timestamp":1773504375767,"segment":0}
{"run":8,"commit":"57b2437","metric":755.366596363412,"metrics":{},"status":"checks_failed","description":"Attempted removing encode lookup table entirely and always using previous ring entry reference; faster but broke chimp128 golden vector encoding compatibility","timestamp":1773504442244,"segment":0}
{"run":9,"commit":"a9173d4","metric":749.2119429059167,"metrics":{},"status":"keep","description":"Minor hot-loop cleanup: iterate encode input as `for &curr in &input[1..]` to avoid repeated dereferencing, plus retain updated autoresearch notes","timestamp":1773504487506,"segment":0}
{"run":10,"commit":"a9173d4","metric":763.810846117007,"metrics":{},"status":"discard","description":"Tried preallocating decode output with Vec::with_capacity(count); benchmark regressed on target workload","timestamp":1773504534177,"segment":0}
{"run":11,"commit":"a9173d4","metric":750.5096478868695,"metrics":{},"status":"discard","description":"Tested zero-initializing chimp128 encode ring buffer now that lookup-miss path no longer scans sentinels; no improvement","timestamp":1773504590767,"segment":0}
{"run":12,"commit":"641f20a","metric":555.5697622385246,"metrics":{},"status":"keep","description":"Optimize bitstream hot paths: add byte-aligned fast paths in put_u64_lowest_bits/read_u64_lowest_bits and inline bit operations in src/bits.rs","timestamp":1773504674376,"segment":0}
{"run":13,"commit":"bb996da","metric":548.5704538310441,"metrics":{},"status":"keep","description":"Reduce chimp128 encode leading-zero overhead by using new bin_leading_and_code(xor) helper to compute bin count and 3-bit code in one match","timestamp":1773504752344,"segment":0}
{"run":14,"commit":"bb996da","metric":0,"metrics":{},"status":"crash","description":"Tried wrapping_sub-based lookup age check in chimp128 encode; compile failed due ambiguous integer type for index","timestamp":1773504797098,"segment":0}
{"run":15,"commit":"bb996da","metric":558.9305315542938,"metrics":{},"status":"checks_failed","description":"Retried chimp128 lookup age check with wrapping_sub and explicit usize index; benchmark near best but correctness checks failed (gorilla property test), so discarded","timestamp":1773504848892,"segment":0}
{"run":16,"commit":"85c4107","metric":545.0697426967323,"metrics":{},"status":"keep","description":"Fix gorilla correctness for high-leading-zero xors by capping encoded leading-zero count to 31 (5-bit field); checks now stable and chimp128 benchmark also improved","timestamp":1773505179362,"segment":0}
{"run":17,"commit":"85c4107","metric":548.142024266396,"metrics":{},"status":"discard","description":"Retested replacing chimp128 decode assert! with debug_assert! after bitstream optimizations; still slightly worse than best","timestamp":1773505224723,"segment":0}
{"run":18,"commit":"85c4107","metric":551.9426127223354,"metrics":{},"status":"discard","description":"Tried reusing a precomputed chimp128 lookup key (`(curr_bits as usize) & 0x3FFF`) to avoid duplicate mask/cast; regressed","timestamp":1773505285094,"segment":0}
{"run":19,"commit":"c4b29ed","metric":534.9991373464616,"metrics":{},"status":"keep","description":"Add dedicated aligned 64-bit fast paths in bit I/O: use put_u64 for writes and from_be_bytes slice read for count==64 when bit-aligned","timestamp":1773505346814,"segment":0}
{"run":20,"commit":"c4b29ed","metric":546.3810609720598,"metrics":{},"status":"discard","description":"Tried unsafe unaligned u64 read in aligned count==64 Bitread fast path to avoid byte copy; regressed benchmark","timestamp":1773505385573,"segment":0}
{"run":21,"commit":"c4b29ed","metric":546.0811084746045,"metrics":{},"status":"discard","description":"Retested preallocating chimp128 decode output Vec with capacity(count); still slower on target benchmark","timestamp":1773505427051,"segment":0}
{"run":22,"commit":"c4b29ed","metric":541.6063620350355,"metrics":{},"status":"discard","description":"Tried table-based bin_decode array indexing instead of match; slight regression vs current best","timestamp":1773505471188,"segment":0}
{"run":23,"commit":"c4b29ed","metric":545.7521914139448,"metrics":{},"status":"discard","description":"Removed chimp128 decode ring-buffer initialization assert check entirely; no improvement versus best","timestamp":1773505521480,"segment":0}
{"run":24,"commit":"c4b29ed","metric":545.7781349639364,"metrics":{},"status":"discard","description":"Tried preallocating chimp128 encode BytesMut with input.len()*8 capacity to avoid growth reallocations; no gain","timestamp":1773505566989,"segment":0}
{"run":25,"commit":"c4b29ed","metric":545.0174019030273,"metrics":{},"status":"discard","description":"Tested forcing inline(always) for hot bitstream methods after adding aligned fast paths; no further improvement","timestamp":1773505628381,"segment":0}
{"run":26,"commit":"c4b29ed","metric":557.8035833313861,"metrics":{},"status":"discard","description":"Tried 0-sentinel lookup encoding (store index+1) in chimp128 encode to avoid u32::MAX checks; significantly slower","timestamp":1773505698160,"segment":0}
{"run":27,"commit":"c4b29ed","metric":547.0212138915049,"metrics":{},"status":"discard","description":"Tried index-based while loop for chimp128 encode input traversal instead of slice iterator; regressed","timestamp":1773505751737,"segment":0}
{"run":28,"commit":"c4b29ed","metric":538.3998302756396,"metrics":{},"status":"discard","description":"Tried while-loop traversal in chimp128 decode to reduce iterator overhead; slightly slower than best","timestamp":1773505804459,"segment":0}
{"run":29,"commit":"c4b29ed","metric":556.9822550183313,"metrics":{},"status":"discard","description":"Re-tested chimp128 encode lookup table as usize (vs u32) after other optimizations; clearly slower","timestamp":1773505866152,"segment":0}
{"run":30,"commit":"c4b29ed","metric":567.3751975532974,"metrics":{},"status":"discard","description":"Tried generic byte-multiple fast paths (count%8==0) in bit read/write using to_be_bytes/copy_from_slice; significantly slower","timestamp":1773505937754,"segment":0}
{"run":31,"commit":"c4b29ed","metric":549.5117675531523,"metrics":{},"status":"discard","description":"Tested forcing inline(always) for bin_leading_and_code helper used in chimp128 encode; regressed","timestamp":1773506003591,"segment":0}
{"run":32,"commit":"c4b29ed","metric":547.021699355255,"metrics":{},"status":"checks_failed","description":"Tried omitting trailing zero flush byte when bitstream ends on byte boundary in Bitwrite::into_bytes; breaks golden encoded byte compatibility across codecs","timestamp":1773506053205,"segment":0}
{"run":33,"commit":"c4b29ed","metric":569.6597964131449,"metrics":{},"status":"discard","description":"Retested zero-initializing chimp128 encode ring buffer with current optimized bit paths; regressed heavily","timestamp":1773506100949,"segment":0}
{"run":34,"commit":"c4b29ed","metric":542.9519910935428,"metrics":{},"status":"discard","description":"Tried using slice try_into for aligned 64-bit Bitread fast path instead of copy_from_slice; slower","timestamp":1773506173705,"segment":0}
{"run":35,"commit":"2741ecf","metric":527.3073391516542,"metrics":{},"status":"keep","description":"Speed up small bit-field operations in Bitread/Bitwrite by adding single-byte fit fast paths for read_u64_lowest_bits/put_u64_lowest_bits (hot for chimp128 control fields)","timestamp":1773506281558,"segment":0}
{"run":36,"commit":"2741ecf","metric":0,"metrics":{},"status":"crash","description":"Attempted thread-local generation-stamped lookup table reuse for chimp128 encode to avoid per-call 16k clear; initial implementation failed borrow checker","timestamp":1773506379202,"segment":0}
{"run":37,"commit":"4d4bda4","metric":526.951867330305,"metrics":{},"status":"keep","description":"Implement thread-local generation-stamped lookup cache for chimp128 encode to avoid reinitializing 16,384-entry lookup array each call","timestamp":1773506477356,"segment":0}
{"run":38,"commit":"4d4bda4","metric":536.1587563456966,"metrics":{},"status":"discard","description":"Tested replacing thread-local RefCell lookup state with UnsafeCell to remove borrow checks; regressed benchmark","timestamp":1773506555808,"segment":0}
{"run":39,"commit":"4d4bda4","metric":530.2217389699239,"metrics":{},"status":"discard","description":"Tried chimp128-specific bit-width wrapper methods (put_u3/u6/u7 and read_u3/u6/u7) to specialize control-field I/O; regressed","timestamp":1773506672371,"segment":0}
{"run":40,"commit":"4d4bda4","metric":536.0626416068453,"metrics":{},"status":"discard","description":"Tried packed u64 lookup entries (epoch|index) for thread-local chimp128 cache to reduce struct field loads; regressed","timestamp":1773506757590,"segment":0}
{"run":41,"commit":"4d4bda4","metric":549.3440697796715,"metrics":{},"status":"discard","description":"Retried preallocating chimp128 encode output buffer (BytesMut::with_capacity(input.len()*8)) on new baseline; still regressed","timestamp":1773506809802,"segment":0}
{"run":42,"commit":"4d4bda4","metric":548.5864995279992,"metrics":{},"status":"discard","description":"Tried explicit count==1 fast paths in generic bit read/write methods; worsened branch behavior and regressed runtime","timestamp":1773506867602,"segment":0}
{"run":43,"commit":"232118c","metric":526.5303745140408,"metrics":{},"status":"keep","description":"Re-evaluated chimp128 decode output preallocation on current baseline: return early with Vec::new for empty and use Vec::with_capacity(count) for decode results","timestamp":1773506914948,"segment":0}
{"run":44,"commit":"232118c","metric":540.1201229842205,"metrics":{},"status":"discard","description":"Retested zero-initializing chimp128 encode ring buffer after lookup-cache/preallocation changes; still regressed","timestamp":1773506977015,"segment":0}
{"run":45,"commit":"232118c","metric":544.9989692812536,"metrics":{},"status":"discard","description":"Tried precomputed BIT_MASKS lookup table for small-width bit read/write mask generation; regressed","timestamp":1773507036508,"segment":0}
{"run":46,"commit":"d8dd26c","metric":526.0197709158932,"metrics":{},"status":"keep","description":"Inline chimp128 decode bin lookup by replacing bin_decode() calls with direct 8-entry leading-zero table indexing on 3-bit codes","timestamp":1773507107338,"segment":0}
{"run":47,"commit":"d8dd26c","metric":534.4834001391595,"metrics":{},"status":"discard","description":"Tried hoisting chimp decode bin table to module-level const CHIMP_BINS instead of inline literals; regressed","timestamp":1773507171613,"segment":0}
{"run":48,"commit":"d8dd26c","metric":526.3469667353759,"metrics":{},"status":"discard","description":"Tried unsafe decode output prefill via Vec::with_capacity + set_len + indexed writes to avoid push overhead; slightly slower than best","timestamp":1773507301824,"segment":0}
{"run":49,"commit":"2be9ebd","metric":479.8389552574758,"metrics":{},"status":"keep","description":"Refactor generic bit read/write loops to align-first byte-block processing (unaligned head bits, branchless byte chunk loop, tail bits), cutting per-iteration branching overhead","timestamp":1773507391743,"segment":0}
{"run":50,"commit":"18a205a","metric":447.33449102749296,"metrics":{},"status":"keep","description":"Further optimize bit I/O unaligned head handling by consuming initial partial byte in one packed operation (both write and read) before byte-chunk loops","timestamp":1773507450393,"segment":0}
{"run":51,"commit":"4f62c5d","metric":415.49565942946043,"metrics":{},"status":"keep","description":"Eliminate per-bit tail loops in bit read/write: handle final sub-byte remainder with single packed operation (write pending bitbuf directly, read from current byte with mask/shift)","timestamp":1773507508174,"segment":0}
{"run":52,"commit":"4f62c5d","metric":477.1010615716239,"metrics":{},"status":"discard","description":"Tried narrowing chimp128 decode best_index to usize directly to remove cast in ring lookup; regressed badly on benchmark","timestamp":1773507566460,"segment":0}
{"run":53,"commit":"4f62c5d","metric":433.29485275377675,"metrics":{},"status":"discard","description":"Retried unsafe decode prefill (Vec::set_len + indexed writes) on new bitstream baseline; clearly slower than push-based decode","timestamp":1773507665818,"segment":0}
{"run":54,"commit":"0b22052","metric":402.32638972466026,"metrics":{},"status":"keep","description":"Optimize chimp128 encode lookup access by avoiding per-iteration LookupEntry copy; read epoch/value directly from entries[key]","timestamp":1773507723283,"segment":0}
{"run":55,"commit":"0b22052","metric":406.858676165442,"metrics":{},"status":"discard","description":"Tried mutating lookup entry fields in-place instead of assigning a LookupEntry struct in chimp128 encode; regressed","timestamp":1773507765723,"segment":0}
{"run":56,"commit":"0b22052","metric":412.2543178192327,"metrics":{},"status":"discard","description":"Tried replacing chimp128 decode bin table indexing with explicit match on 3-bit leading code; regressed","timestamp":1773507826758,"segment":0}
{"run":57,"commit":"9dbe5d2","metric":373.1848294725018,"metrics":{},"status":"keep","description":"Force inline(always) on hot bitstream primitives (put_bit/put_u64_lowest_bits/read_bit/read_u64_lowest_bits) after loop refactors; large win","timestamp":1773507883225,"segment":0}
{"run":58,"commit":"9dbe5d2","metric":384.5340136862712,"metrics":{},"status":"discard","description":"Tried adding inline(always) to put_f64/read_f64 wrappers on top of inlined bit primitives; regressed","timestamp":1773507925934,"segment":0}
{"run":59,"commit":"9dbe5d2","metric":374.9380767580659,"metrics":{},"status":"discard","description":"Retested inline(always) for bin_leading_and_code after latest bitstream wins; still slightly slower","timestamp":1773507973259,"segment":0}
{"run":60,"commit":"9dbe5d2","metric":382.6562919753807,"metrics":{},"status":"discard","description":"Retested changing chimp128 decode assert to debug_assert after recent optimizations; regressed","timestamp":1773508017502,"segment":0}
{"run":61,"commit":"9647256","metric":368.7577026392289,"metrics":{},"status":"keep","description":"Speed up mid-sized bit transfers by adding 32-bit chunk loops in put_u64_lowest_bits/read_u64_lowest_bits (use put_u32/from_be_bytes before byte/tail handling)","timestamp":1773508078637,"segment":0}
{"run":62,"commit":"9647256","metric":0,"metrics":{},"status":"crash","description":"Attempted adding 16-bit chunk fast paths in bit read/write; edit introduced malformed src/bits.rs braces (compile error), reverted","timestamp":1773508142320,"segment":0}
{"run":63,"commit":"ffb5f73","metric":367.7745482436005,"metrics":{},"status":"keep","description":"Force inline(always) for remaining hot bitstream methods (put_bit, put_u64_lowest_bits, read_bit) on top of read_u64 inlining and chunked loops","timestamp":1773508285798,"segment":0}
{"run":64,"commit":"ffb5f73","metric":371.9893372329507,"metrics":{},"status":"discard","description":"Tried unsafe unaligned u32 reads in read_u64_lowest_bits 32-bit chunk loop to avoid copy_from_slice; regressed","timestamp":1773508330270,"segment":0}
{"run":65,"commit":"ffb5f73","metric":378.69594809864225,"metrics":{},"status":"discard","description":"Tried unsafe get_unchecked/get_unchecked_mut for chimp128 lookup table accesses (key masked to 14 bits); regressed","timestamp":1773508387878,"segment":0}
{"run":66,"commit":"ffb5f73","metric":0,"metrics":{},"status":"crash","description":"Attempted adding layered 32/16-bit chunk loops in bit read/write; broad text replacement corrupted src/bits.rs test module braces","timestamp":1773508450687,"segment":0}
{"run":67,"commit":"38e8438","metric":349.0826878012644,"metrics":{},"status":"keep","description":"Add wider chunk paths in bit transfer core: 32-bit block writes in put_u64_lowest_bits plus 16-bit block reads in read_u64_lowest_bits after 32-bit chunks","timestamp":1773508538774,"segment":0}
{"run":68,"commit":"b5b162d","metric":344.0384787565408,"metrics":{},"status":"keep","description":"Add 16-bit block writes in put_u64_lowest_bits (after 32-bit chunk loop) to reduce byte-loop iterations for mid-sized payloads","timestamp":1773508584448,"segment":0}
{"run":69,"commit":"b5b162d","metric":345.4189586710191,"metrics":{},"status":"discard","description":"Tried dedicated aligned count==32 read/write fast paths in bitstream core in addition to chunk loops; slightly regressed","timestamp":1773508636709,"segment":0}
{"run":70,"commit":"f3810ae","metric":334.3839392421396,"metrics":{},"status":"keep","description":"Add true small-width specialized bit ops (put_small/read_small const-generic for <=8 bits) and switch chimp128 hot 3/6/7-bit control fields to these paths","timestamp":1773508849641,"segment":0}
{"run":71,"commit":"f3810ae","metric":0,"metrics":{},"status":"crash","description":"Attempted splitting chimp128 thread-local lookup cache into separate epochs/values arrays; initial version failed borrow checker due simultaneous mutable borrows","timestamp":1773508949643,"segment":0}
{"run":72,"commit":"8c0dba6","metric":325.49438171286823,"metrics":{},"status":"keep","description":"Refactor chimp128 generation-stamped lookup cache to structure-of-arrays (epochs + values) and access via single RefCell borrow in loop","timestamp":1773509050351,"segment":0}
{"run":73,"commit":"8c0dba6","metric":325.8998302165498,"metrics":{},"status":"discard","description":"Tried unsafe unaligned u16 loads in read_u64_lowest_bits 16-bit chunk loop to avoid copy_from_slice; slight regression","timestamp":1773509103253,"segment":0}
{"run":74,"commit":"8c0dba6","metric":325.64221312339816,"metrics":{},"status":"discard","description":"Tested shrinking chimp128 lookup epoch metadata from u32 to u16 to reduce cache footprint; no improvement","timestamp":1773509170093,"segment":0}
{"run":75,"commit":"8c0dba6","metric":330.494866342572,"metrics":{},"status":"discard","description":"Control rerun with no code changes to estimate benchmark noise on current best branch; observed higher metric this run","timestamp":1773509227208,"segment":0}
{"run":76,"commit":"8c0dba6","metric":0,"metrics":{},"status":"crash","description":"Tried branch hinting with std::hint::likely on chimp128 trailing-threshold branch; unavailable on stable toolchain (unstable feature)","timestamp":1773509302003,"segment":0}
{"run":77,"commit":"8c0dba6","metric":328.6825921261578,"metrics":{},"status":"discard","description":"Retested forcing inline(always) on put_bit and put_u64_lowest_bits after small-width specialization and SoA lookup refactor; regressed","timestamp":1773509398610,"segment":0}
{"run":78,"commit":"8c0dba6","metric":329.3371882957032,"metrics":{},"status":"discard","description":"Tried destructuring lookup_state fields into local epochs/values slices to reduce repeated field dereference in chimp128 encode loop; regressed","timestamp":1773509473439,"segment":0}
{"run":79,"commit":"8c0dba6","metric":339.1628759577037,"metrics":{},"status":"discard","description":"Retested removing chimp128 decode ring-buffer initialization assert in current optimized baseline; clear regression","timestamp":1773509540863,"segment":0}
{"run":80,"commit":"8c0dba6","metric":0,"metrics":{},"status":"crash","description":"Attempted manual byte-assembly in read_u64 chunk loops (replace from_be_bytes/copy_from_slice); broad text replacement corrupted trailing src/bits.rs braces","timestamp":1773509604590,"segment":0}
{"run":81,"commit":"968fcb8","metric":325.3204071275001,"metrics":{},"status":"keep","description":"Reorder chimp128 encode branch by making trailing<=13 path the first condition (likely case on noisy patterns), preserving semantics with inverted if/else layout","timestamp":1773509700748,"segment":0}
