{"run":82,"commit":"968fcb8","metric":327.78212770684144,"metrics":{},"status":"discard","description":"Tried reordering chimp128 decode top-level branch to handle control-bit=1 path first (mirroring likely encode branch); regressed","timestamp":1773509767384,"segment":0}
{"run":83,"commit":"968fcb8","metric":326.60349463539546,"metrics":{},"status":"discard","description":"Tried manual 4-byte assembly in read_u64_lowest_bits 32-bit chunk loop (avoid copy_from_slice/from_be_bytes); regressed","timestamp":1773509832465,"segment":0}
{"run":84,"commit":"968fcb8","metric":0,"metrics":{},"status":"crash","description":"Tried replacing thread-local RefCell lookup cache with UnsafeCell to remove borrow overhead; implementation broke imports/type inference and failed to compile","timestamp":1773509909217,"segment":0}
{"run":85,"commit":"968fcb8","metric":325.7257021869714,"metrics":{},"status":"discard","description":"Retested inline(always) on put_f64/read_f64 wrappers with latest baseline; slightly slower","timestamp":1773509968032,"segment":0}
{"run":86,"commit":"968fcb8","metric":333.851767810567,"metrics":{},"status":"discard","description":"Tried explicitly caching lookup_state.epochs[key] into local before epoch compare in chimp128 encode loop; substantial regression","timestamp":1773510063295,"segment":0}
